{
  "schemaVersion": 1,
  "artifactKind": "datapack-source-governance-policy",
  "policyVersion": "2026-08-29",
  "retentionClasses": [
    {
      "id": "standard-90d",
      "retentionDays": 90
    }
  ],
  "reasonCodeEscalations": [
    {
      "reasonCodes": [
        "SOURCE_LINEAGE_BROKEN",
        "SOURCE_DIFF_MISSING"
      ],
      "responsibleRole": "datapack-data-steward",
      "alertRoute": "github:area-datapack",
      "escalationHours": 4
    },
    {
      "reasonCodes": [
        "SOURCE_FRESHNESS_POLICY_MISSING",
        "SOURCE_SNAPSHOT_EXPIRED"
      ],
      "responsibleRole": "datapack-source-owner",
      "alertRoute": "github:release-blocker",
      "escalationHours": 4
    },
    {
      "reasonCodes": [
        "RAW_RETENTION_OVERDUE",
        "LEGAL_HOLD_INVALID"
      ],
      "responsibleRole": "datapack-data-steward",
      "alertRoute": "github:area-operations",
      "escalationHours": 24
    },
    {
      "reasonCodes": [
        "LICENSE_REVIEW_REQUIRED",
        "REDISTRIBUTION_NOT_APPROVED"
      ],
      "responsibleRole": "datapack-release-approver",
      "alertRoute": "github:release-blocker",
      "escalationHours": 4
    },
    {
      "reasonCodes": [
        "SOURCE_GOVERNANCE_OWNER_MISSING"
      ],
      "responsibleRole": "datapack-source-owner",
      "alertRoute": "github:area-release-governance",
      "escalationHours": 4
    }
  ],
  "sources": [
    {
      "sourceId": "incheon-transit-accessibility",
      "sourceClassId": "static_accessibility_facility",
      "retentionClassId": "standard-90d",
      "ownerRole": "datapack-source-owner",
      "stewardRole": "datapack-data-steward",
      "approvalRole": "datapack-release-approver",
      "escalationHours": 4,
      "alertRoute": "github:area-datapack",
      "licenseReview": {
        "status": "APPROVED",
        "termsHash": "16d4e5ffd5eacf0514a6f08ea69b21589c1f5f38a3d9dd48c677b4c81e66ac71",
        "reviewedAt": "2026-08-29T04:49:49.000Z",
        "nextReviewAt": "2027-08-29T04:49:49.000Z",
        "termsUrl": "https://www.data.go.kr/data/15083478/fileData.do",
        "reviewedProvider": "인천교통공사",
        "reviewedDatasetUrl": "https://www.data.go.kr/data/15083478/fileData.do",
        "redistributionScopes": [
          "DERIVED_DATAPACK"
        ],
        "approvedByRole": "datapack-release-approver"
      }
    },
    {
      "sourceId": "kric-train-operation-organ",
      "sourceClassId": "static_network_metadata",
      "retentionClassId": "standard-90d",
      "ownerRole": "datapack-source-owner",
      "stewardRole": "datapack-data-steward",
      "approvalRole": "datapack-release-approver",
      "escalationHours": 4,
      "alertRoute": "github:area-datapack",
      "licenseReview": {
        "status": "APPROVED",
        "termsHash": "bd7b209e47aeb0996ccdd6d1913d8a732ae8539cb9e648a55cfbebb9a64d0fd8",
        "reviewedAt": "2026-07-13T13:30:00Z",
        "nextReviewAt": "2027-07-13T13:30:00Z",
        "termsUrl": "https://data.kric.go.kr/rips/M_01_02/detail.do?id=266&service=convenientInfo&operation=trainOperationOrgan&page=3",
        "reviewedProvider": "국가철도공단",
        "reviewedDatasetUrl": "https://data.kric.go.kr/rips/M_01_02/detail.do?id=266&service=convenientInfo&operation=trainOperationOrgan&page=3",
        "redistributionScopes": [
          "DERIVED_DATAPACK"
        ],
        "approvedByRole": "datapack-release-approver"
      }
    },
    {
      "sourceId": "kric-station-convenience-standard",
      "sourceClassId": "static_accessibility_facility",
      "retentionClassId": "standard-90d",
      "ownerRole": "datapack-source-owner",
      "stewardRole": "datapack-data-steward",
      "approvalRole": "datapack-release-approver",
      "escalationHours": 4,
      "alertRoute": "github:area-datapack",
      "licenseReview": {
        "status": "APPROVED",
        "termsHash": "39978b3c3dd3fb64b7f15d739453b19ad0b51a0f216cea22d3efb77dbfebf398",
        "reviewedAt": "2026-07-28T12:42:27Z",
        "nextReviewAt": "2027-07-28T12:42:27Z",
        "termsUrl": "https://data.kric.go.kr/rips/M_01_02/detail.do?id=430&service=handicapped&operation=stationCnvFacl&page=1",
        "reviewedProvider": "국가철도공단",
        "reviewedDatasetUrl": "https://data.kric.go.kr/rips/M_01_02/detail.do?id=430&service=handicapped&operation=stationCnvFacl&page=1",
        "redistributionScopes": [
          "DERIVED_DATAPACK"
        ],
        "approvedByRole": "datapack-release-approver"
      }
    },
    {
      "sourceId": "kric-subway-timetable",
      "sourceClassId": "planned_timetable",
      "retentionClassId": "standard-90d",
      "ownerRole": "datapack-source-owner",
      "stewardRole": "datapack-data-steward",
      "approvalRole": "datapack-release-approver",
      "escalationHours": 4,
      "alertRoute": "github:area-datapack",
      "licenseReview": {
        "status": "APPROVED",
        "termsHash": "3496800e96105558c3ce0e96df3bdd425a56c8420f8c7b93cca3e8309823d0f2",
        "reviewedAt": "2026-07-09T00:00:00Z",
        "nextReviewAt": "2027-07-09T00:00:00Z",
        "termsUrl": "https://data.kric.go.kr/rips/M_01_02/detail.do?id=162&service=trainUseInfo&operation=subwayTimetable&page=2",
        "reviewedProvider": "국가철도공단",
        "reviewedDatasetUrl": "https://data.kric.go.kr/rips/M_01_02/detail.do?id=162&service=trainUseInfo&operation=subwayTimetable&page=2",
        "redistributionScopes": [
          "DERIVED_DATAPACK"
        ],
        "approvedByRole": "datapack-release-approver"
      }
    },
    {
      "sourceId": "molit-urban-rail-full-route",
      "sourceClassId": "static_network_metadata",
      "retentionClassId": "standard-90d",
      "ownerRole": "datapack-source-owner",
      "stewardRole": "datapack-data-steward",
      "approvalRole": "datapack-release-approver",
      "escalationHours": 4,
      "alertRoute": "github:area-datapack",
      "licenseReview": {
        "status": "APPROVED",
        "termsHash": "2d0f88d855cf96413c17a412cb8197f1fb7d1e904b4ee0d42f99ead4fa558d53",
        "reviewedAt": "2026-07-11T15:00:00Z",
        "nextReviewAt": "2027-07-11T15:00:00Z",
        "termsUrl": "https://www.data.go.kr/data/15122916/fileData.do",
        "reviewedProvider": "국토교통부",
        "reviewedDatasetUrl": "https://www.data.go.kr/data/15122916/fileData.do",
        "redistributionScopes": [
          "DERIVED_DATAPACK"
        ],
        "approvedByRole": "datapack-release-approver"
      }
    },
    {
      "sourceId": "seoul-metro-accessibility",
      "sourceClassId": "static_accessibility_facility",
      "retentionClassId": "standard-90d",
      "ownerRole": "datapack-source-owner",
      "stewardRole": "datapack-data-steward",
      "approvalRole": "datapack-release-approver",
      "escalationHours": 4,
      "alertRoute": "github:area-datapack",
      "licenseReview": {
        "status": "APPROVED",
        "termsHash": "cd1063d4aa4b6290b1f4edabb9a74e62d70f8da5044aa4608b7f1e45e10c5963",
        "reviewedAt": "2026-07-11T15:00:00Z",
        "nextReviewAt": "2027-07-11T15:00:00Z",
        "termsUrl": "https://www.data.go.kr/data/15143843/openapi.do",
        "reviewedProvider": "서울교통공사",
        "reviewedDatasetUrl": "https://www.data.go.kr/data/15143843/openapi.do",
        "redistributionScopes": [
          "DERIVED_DATAPACK"
        ],
        "approvedByRole": "datapack-release-approver"
      }
    },
    {
      "sourceId": "seoul-metro-route-map-positions",
      "sourceClassId": "route_map_positions",
      "retentionClassId": "standard-90d",
      "ownerRole": "datapack-source-owner",
      "stewardRole": "datapack-data-steward",
      "approvalRole": "datapack-release-approver",
      "escalationHours": 4,
      "alertRoute": "github:area-datapack",
      "licenseReview": {
        "status": "APPROVED",
        "termsHash": "f7c7534e3fbac3b218bd91c55da7259416478cb5eaa259400576cd04e5fef0e7",
        "reviewedAt": "2026-08-14T15:34:07.000Z",
        "nextReviewAt": "2027-08-14T15:34:07.000Z",
        "termsUrl": "https://www.data.go.kr/data/15099316/fileData.do",
        "reviewedProvider": "서울교통공사",
        "reviewedDatasetUrl": "https://www.data.go.kr/data/15099316/fileData.do",
        "redistributionScopes": [
          "DERIVED_DATAPACK"
        ],
        "approvedByRole": "datapack-release-approver"
      }
    },
    {
      "sourceId": "seoulmetro-cyberstation-route-map",
      "sourceClassId": "route_map_asset_historical",
      "retentionClassId": "standard-90d",
      "ownerRole": "datapack-source-owner",
      "stewardRole": "datapack-data-steward",
      "approvalRole": "datapack-release-approver",
      "escalationHours": 4,
      "alertRoute": "github:area-datapack",
      "licenseReview": {
        "status": "APPROVED",
        "termsHash": "846453610a0713353caad62ce8eea88648e7dbe8f73acfcb8e2f70a369a59c2c",
        "reviewedAt": "2026-07-11T15:00:00Z",
        "nextReviewAt": "2027-07-11T15:00:00Z",
        "termsUrl": "https://www.seoulmetro.co.kr/kr/cyberStation.do",
        "reviewedProvider": "서울교통공사",
        "reviewedDatasetUrl": "https://www.seoulmetro.co.kr/kr/cyberStation.do",
        "redistributionScopes": [
          "DERIVED_DATAPACK"
        ],
        "approvedByRole": "datapack-release-approver"
      }
    },
    {
      "sourceId": "molit-railway-transfer-movement",
      "sourceClassId": "annual_official_file",
      "retentionClassId": "standard-90d",
      "ownerRole": "datapack-source-owner",
      "stewardRole": "datapack-data-steward",
      "approvalRole": "datapack-release-approver",
      "escalationHours": 4,
      "alertRoute": "github:area-datapack",
      "licenseReview": {
        "status": "APPROVED",
        "termsHash": "f85109fd1d1ea9135bf8655b347080b0b66aea903d2c10b8f0a08c60388ab951",
        "reviewedAt": "2026-08-14T15:34:07.000Z",
        "nextReviewAt": "2027-08-14T15:34:07.000Z",
        "termsUrl": "https://www.data.go.kr/data/15130556/fileData.do",
        "reviewedProvider": "국토교통부",